{
  "schemaVersion": 1,
  "id": "claude-ollama-main",
  "displayName": "Claude Code + Qwen3.8 27B",
  "engine": "claude",
  "provider": "ollama",
  "plan": "local",
  "region": "local",
  "transport": "anthropic-messages",
  "endpoint": "http://127.0.0.1:32100",
  "models": {
    "primary": "qwen3.8-27b:256k",
    "small": "qwen3.8-27b:256k"
  },
  "modelMetadata": {
    "qwen3.8-27b:256k": {
      "contextWindowTokens": 262144,
      "outputWindowTokens": 32768,
      "autoCompactWindowTokens": 262144
    }
  },
  "compatibility": {
    "minCliVersion": "2.1.193",
    "ollamaArtifact": {
      "minimumVersion": "0.32.12",
      "tag": "qwen3.8-27b:256k",
      "baseTag": "qwen3.8:27b",
      "numCtx": 262144,
      "quantization": "Q4_K_M",
      "manifestDigest": "sha256:8040835723046ec2631b64b960d44414636ea5147942a7d68eaaa7ccdb492e20",
      "baseManifestDigest": "sha256:22130167c4c20e20c7b71454612966ca8e8171e9b3cc8ab6ce8aa6cbfec79643",
      "configDigest": "sha256:492b2922d38e553cabc2d319345644ed482874fbf5e5c9e4495cbf8e17b0cf5f",
      "modelBlobDigest": "sha256:f5f1dd8920d417aac2718b0bda3403da274301efdd6760b4f0f4b864ff2ad57d",
      "projectorBlobDigest": "sha256:ac3714bfdddeca31351f2752bf1a63f266f4df87c0b68c895e44945ca704448e",
      "parametersDigest": "sha256:f31338adbd0f8703936e46b65304ae9369378184f88dd20b9760b0d8ed8b50f0",
      "draftNumPredict": 0,
      "numBatch": 128,
      "parameters": {
        "draft_num_predict": 0,
        "min_p": 0,
        "num_batch": 128,
        "num_ctx": 262144,
        "presence_penalty": 0,
        "repeat_penalty": 1,
        "temperature": 1,
        "top_k": 20,
        "top_p": 0.95
      },
      "renderer": "qwen3.8",
      "parser": "qwen3.5"
    }
  },
  "auth": {
    "type": "none"
  },
  "capabilities": {
    "tools": true,
    "streaming": true,
    "images": true,
    "machineRun": true
  },
  "sources": [
    "https://docs.ollama.com/integrations/claude-code"
  ],
  "requiresSecret": false,
  "virtualReady": true,
  "dataDestination": "LocalGpuBroker Ollama endpoint (127.0.0.1:32100)",
  "notes": "Machine run is externally sandboxed; no cloud or fallback."
}
