{
  "schemaVersion": 1,
  "displayName": "Codex 千问 Token Plan (Responses)",
  "defaultEffort": "max",
  "effortLevels": [
    "low",
    "medium",
    "high",
    "xhigh",
    "max"
  ],
  "codexProviderId": "aicli_qwen_token_plan",
  "codexModelCatalog": "qwen3.7-max-2026-06-08-codex.json",
  "plan": "token-plan",
  "capabilities": {
    "tools": true,
    "contextStats": true,
    "images": false,
    "streaming": true,
    "effort": true
  },
  "requiresSecret": true,
  "notes": "兼容入口已封闭为精确 qwen3.7-max-2026-06-08；Responses、Token Plan 端点与 max effort 固定，不允许模型或 fallback 覆盖。它与 Qwen3.8 Max Workspace 按量 Profile 完全隔离。",
  "region": "cn-beijing",
  "id": "codex-qwen-token-plan",
  "auth": {
    "type": "api-key",
    "envKey": "AICLI_CODEX_PROVIDER_KEY"
  },
  "sources": [
    "https://help.aliyun.com/zh/model-studio/codex"
  ],
  "endpoint": "https://token-plan.cn-beijing.maas.aliyuncs.com/compatible-mode/v1",
  "provider": "qwen",
  "engine": "codex",
  "flexible": false,
  "transport": "responses",
  "models": {
    "small": "qwen3.7-max-2026-06-08",
    "primary": "qwen3.7-max-2026-06-08",
    "candidates": [
      "qwen3.7-max-2026-06-08"
    ]
  },
  "compatibility": { "minCliVersion": "0.144.0", "modelVersion": "qwen3.7-max-2026-06-08" },
  "dataDestination": "阿里云 Token Plan",
  "virtualReady": false
}
