{
  "schemaVersion": 1,
  "displayName": "Codex 千问 3.7 (Responses)",
  "defaultEffort": "high",
  "codexProviderId": "aicli_qwen_paygo",
  "plan": "paygo",
  "capabilities": {
    "tools": true,
    "contextStats": true,
    "images": false,
    "streaming": true,
    "effort": true
  },
  "requiresSecret": true,
  "notes": "默认 max=qwen3.7-max-2026-06-08 / plus=qwen3.7-plus-2026-05-26（DashScope /models 2026-07-13）。可 --model 覆盖。",
  "region": "cn-beijing",
  "id": "codex-qwen-paygo",
  "auth": {
    "type": "api-key",
    "envKey": "AICLI_CODEX_PROVIDER_KEY"
  },
  "sources": [
    "https://help.aliyun.com/zh/model-studio/codex"
  ],
  "endpoint": "https://dashscope.aliyuncs.com/compatible-mode/v1",
  "provider": "qwen",
  "engine": "codex",
  "flexible": true,
  "transport": "responses",
  "models": {
    "small": "qwen3.7-plus-2026-05-26",
    "primary": "qwen3.7-max-2026-06-08",
    "candidates": [
      "qwen3.7-max-2026-06-08",
      "qwen3.7-plus-2026-05-26",
      "qwen3.7-max",
      "qwen3.7-plus",
      "qwen3.7-max-2026-05-20",
      "qwen3.7-plus-2026-05-26",
      "qwen3.7-max-preview"
    ]
  },
  "dataDestination": "阿里云百炼（按量 Responses）",
  "virtualReady": false
}
