{
  "schemaVersion": 1,
  "id": "codex-deepseek-v4-pro",
  "displayName": "Codex + DeepSeek V4 Pro 0813",
  "engine": "codex",
  "provider": "deepseek",
  "plan": "paygo",
  "region": "global",
  "transport": "responses",
  "endpoint": "https://api.deepseek.com",
  "codexProviderId": "aicli_deepseek_v4_pro",
  "codexModelCatalog": "deepseek-v4-pro.json",
  "requiresSecret": true,
  "virtualReady": false,
  "auth": {
    "type": "api-key",
    "envKey": "AICLI_CODEX_PROVIDER_KEY"
  },
  "models": {
    "primary": "deepseek-v4-pro",
    "small": "deepseek-v4-pro",
    "candidates": [
      "deepseek-v4-pro"
    ]
  },
  "defaultEffort": "max",
  "effortLevels": [
    "low",
    "high",
    "max"
  ],
  "flexible": false,
  "capabilities": {
    "tools": true,
    "contextStats": true,
    "images": false,
    "streaming": true,
    "effort": true
  },
  "compatibility": {
    "minCliVersion": "0.144.0",
    "modelVersion": "DeepSeek-V4-Pro-0813",
    "apiStatus": "ga"
  },
  "dataDestination": "DeepSeek API",
  "notes": "精确 DeepSeek V4 Pro Profile：API alias deepseek-v4-pro，对应官方版本 DeepSeek-V4-Pro-0813；Responses wire 与 max effort 固定。",
  "sources": [
    "https://api-docs.deepseek.com/quick_start/agent_integrations/codex/",
    "https://api-docs.deepseek.com/quick_start/pricing/",
    "https://api-docs.deepseek.com/updates/"
  ]
}
